{
  "artifact": {
    "canonical_sha256": "8a83e4e6c6b455888d0a3088513f6789f6a8dd30fdb0af4f77002499bd56ccc6",
    "fact_assertion_count": 0,
    "instance_count": 1,
    "path": "artifact.review-missing.json",
    "sha256": "ead738bbb62eb7effd6cad4d8897e85a41026f1b899605d670629f7417269e10"
  },
  "precedence_evidence": [
    {
      "decision_ref": "EXAMPLE-LEGAL-TITLE-PRECEDENCE",
      "group_id": "notice-title-length",
      "id": "a781d2dc133485b953289173fa06eff88074c52a46de0f3034c9f2d5d0059f47",
      "rule_id": "notice-title-legal-limit",
      "source_refs": [
        {
          "line_end": 5,
          "line_start": 5,
          "quote": "Under decision EXAMPLE-LEGAL-TITLE-PRECEDENCE, notice-title-legal-limit supersedes notice-title-general-limit when both rules apply.",
          "source_id": "contextual-title-guidance"
        }
      ],
      "supersedes": "notice-title-general-limit"
    }
  ],
  "protocol": "content-rule-receipt/2",
  "resolutions": [
    {
      "competing_rule_ids": [
        "notice-title-general-limit",
        "notice-title-legal-limit"
      ],
      "decision_refs": [],
      "group_id": "notice-title-length",
      "instance_id": "missing-variant-notice",
      "precedence_edge_ids": [],
      "reason": "unresolved_member",
      "selected_rule_id": null,
      "status": "REVIEW",
      "superseded_rule_ids": []
    }
  ],
  "results": [
    {
      "applicability": {
        "instances": [
          {
            "competing_rule_ids": [
              "notice-title-legal-limit"
            ],
            "condition": "TRUE",
            "decision_refs": [],
            "facts": [],
            "group_id": "notice-title-length",
            "instance_id": "missing-variant-notice",
            "precedence_edge_ids": [],
            "selected_rule_id": null,
            "state": "RULE_CONFLICT"
          }
        ],
        "out_of_scope_count": 0,
        "source_refs": []
      },
      "check": "character_limit",
      "description": "Limit standard notice titles to 50 Unicode code points after NFC normalization.",
      "evidence": [],
      "message": "Contextual applicability could not be resolved.",
      "review_evidence": [
        {
          "assertion_ids": [],
          "competing_rule_ids": [
            "notice-title-legal-limit"
          ],
          "fact_ids": [],
          "group_id": "notice-title-length",
          "instance_id": "missing-variant-notice",
          "reason": "unresolved_rule_conflict",
          "surface": "notice"
        }
      ],
      "rule_id": "notice-title-general-limit",
      "scope": {
        "fields": [
          "title"
        ],
        "surfaces": [
          "notice"
        ]
      },
      "source_refs": [
        {
          "line_end": 1,
          "line_start": 1,
          "quote": "On the notice surface, the title field must contain no more than 50 NFC-normalized Unicode code points.",
          "source_id": "contextual-title-guidance"
        }
      ],
      "status": "REVIEW"
    },
    {
      "applicability": {
        "instances": [
          {
            "competing_rule_ids": [
              "notice-title-general-limit"
            ],
            "condition": "UNKNOWN",
            "decision_refs": [],
            "facts": [
              {
                "accepted_assertion_ids": [],
                "assertions": [],
                "fact": "notice.variant",
                "outcome": "UNKNOWN",
                "unaccepted_assertion_ids": [],
                "value_sha256": null
              }
            ],
            "group_id": "notice-title-length",
            "instance_id": "missing-variant-notice",
            "precedence_edge_ids": [],
            "selected_rule_id": null,
            "state": "UNKNOWN_FACT"
          }
        ],
        "out_of_scope_count": 0,
        "source_refs": [
          {
            "line_end": 2,
            "line_start": 2,
            "quote": "When the instance fact notice.variant equals legal_disclosure, the notice title field must contain no more than 80 NFC-normalized Unicode code points.",
            "source_id": "contextual-title-guidance"
          },
          {
            "line_end": 4,
            "line_start": 4,
            "quote": "The notice-context provider observes notice.variant from the notice component variant for each notice instance; only this observed provider mapping is accepted for deterministic applicability.",
            "source_id": "contextual-title-guidance"
          }
        ]
      },
      "check": "character_limit",
      "description": "Limit legal-disclosure notice titles to 80 Unicode code points after NFC normalization.",
      "evidence": [],
      "message": "Contextual applicability could not be resolved.",
      "review_evidence": [
        {
          "assertion_ids": [],
          "competing_rule_ids": [
            "notice-title-general-limit"
          ],
          "fact_ids": [
            "notice.variant"
          ],
          "group_id": "notice-title-length",
          "instance_id": "missing-variant-notice",
          "reason": "missing_or_unaccepted_fact",
          "surface": "notice"
        }
      ],
      "rule_id": "notice-title-legal-limit",
      "scope": {
        "fields": [
          "title"
        ],
        "surfaces": [
          "notice"
        ]
      },
      "source_refs": [
        {
          "line_end": 2,
          "line_start": 2,
          "quote": "When the instance fact notice.variant equals legal_disclosure, the notice title field must contain no more than 80 NFC-normalized Unicode code points.",
          "source_id": "contextual-title-guidance"
        }
      ],
      "status": "REVIEW"
    }
  ],
  "rule_set": {
    "authority_note": "Adoption, precedence, and fact-provider provenance are recorded claims; this runtime does not authenticate them. Trusted host-controlled adapters must supply facts.",
    "canonical_sha256": "f309c97fb330ca860b63feb4bb7696bcc107692971843e40476900c0c99eaa8c",
    "conflict_group_count": 1,
    "decision_ref": "EXAMPLE-RULESET-ADOPTION",
    "effect": "check result only; the calling workflow decides consequences",
    "fact_definition_count": 1,
    "id": "contextual-title-limits",
    "name": "Contextual notice title limits",
    "owner": "Content standards owner",
    "path": "rules.json",
    "sha256": "523f5800d0964fe739d48b8359cfa370d151facb733ee62a4566e12e6c4e45d3",
    "status": "adopted"
  },
  "sources": [
    {
      "id": "contextual-title-guidance",
      "path": "guidance.md",
      "sha256": "a8a958333eabdedf1f5a4e38b9a8bcbf363c5fd703395fb2d48851831b2b93b4",
      "status": "VERIFIED"
    }
  ],
  "summary": {
    "applicable": 2,
    "failed": 0,
    "not_applicable": 0,
    "passed": 0,
    "review": 2,
    "status": "REVIEW",
    "unresolved_applicability": 2,
    "unresolved_evidence": 2
  },
  "tool": {
    "name": "content-rules",
    "version": "0.2.0"
  }
}
